{
  "$schema": "https://json-schema.org/draft/2020-12/schema",
  "type": "object",
  "properties": {
    "schemaVersion": {
      "const": 1
    },
    "id": {
      "type": "string",
      "pattern": "^[a-z0-9]+(?:-[a-z0-9]+)*$",
      "maxLength": 64
    },
    "system": {
      "type": "object",
      "properties": {
        "id": {
          "type": "string",
          "pattern": "^[a-z0-9]+(?:-[a-z0-9]+)*$",
          "maxLength": 64
        },
        "version": {
          "type": "string",
          "pattern": "^(0|[1-9][0-9]*)\\.(0|[1-9][0-9]*)\\.(0|[1-9][0-9]*)$"
        }
      },
      "required": ["id", "version"],
      "additionalProperties": false
    },
    "template": {
      "type": "object",
      "properties": {
        "id": {
          "type": "string",
          "pattern": "^[a-z0-9]+(?:-[a-z0-9]+)*$",
          "maxLength": 64
        },
        "version": {
          "type": "string",
          "pattern": "^(0|[1-9][0-9]*)\\.(0|[1-9][0-9]*)\\.(0|[1-9][0-9]*)$"
        }
      },
      "required": ["id", "version"],
      "additionalProperties": false
    },
    "displayName": {
      "type": "string",
      "pattern": "\\S"
    },
    "values": {
      "type": "object",
      "propertyNames": {
        "type": "string",
        "pattern": "^[a-z][A-Za-z0-9]*$",
        "maxLength": 64
      },
      "additionalProperties": {
        "type": "integer"
      }
    },
    "createdAt": {
      "type": "string",
      "format": "date-time",
      "pattern": "^\\d{4}-\\d{2}-\\d{2}T\\d{2}:\\d{2}:\\d{2}(\\.\\d+)?Z$"
    },
    "modifiedAt": {
      "type": "string",
      "format": "date-time",
      "pattern": "^\\d{4}-\\d{2}-\\d{2}T\\d{2}:\\d{2}:\\d{2}(\\.\\d+)?Z$"
    },
    "entityType": {
      "type": "string",
      "pattern": "^[a-z0-9]+(?:-[a-z0-9]+)*$",
      "maxLength": 64
    },
    "role": {
      "enum": ["character", "monster"]
    },
    "career": {
      "type": "string",
      "pattern": "\\S"
    },
    "entries": {
      "type": "array",
      "items": {
        "type": "object",
        "properties": {
          "id": {
            "type": "string",
            "pattern": "^[a-z0-9]+(?:-[a-z0-9]+)*$",
            "maxLength": 64
          },
          "category": {
            "type": "string",
            "pattern": "^[a-z0-9]+(?:-[a-z0-9]+)*$",
            "maxLength": 64
          },
          "label": {
            "type": "string",
            "pattern": "\\S"
          },
          "description": {
            "type": "string"
          },
          "source": {
            "type": "string",
            "pattern": "\\S"
          },
          "effects": {
            "type": "array",
            "items": {
              "type": "object",
              "properties": {
                "op": {
                  "const": "multiply"
                },
                "target": {
                  "type": "string",
                  "pattern": "^[a-z][A-Za-z0-9]*$",
                  "maxLength": 64
                },
                "factor": {
                  "type": "integer",
                  "minimum": 1,
                  "maximum": 9007199254740991
                }
              },
              "required": ["op", "target", "factor"],
              "additionalProperties": false
            }
          },
          "metadata": {
            "type": "object",
            "properties": {
              "sourceReview": {
                "type": "string",
                "pattern": "\\S"
              },
              "requirementRefs": {
                "type": "array",
                "items": {
                  "type": "string",
                  "pattern": "\\S"
                }
              },
              "sourceRegisterRefs": {
                "type": "array",
                "items": {
                  "type": "string",
                  "pattern": "\\S"
                }
              }
            },
            "additionalProperties": false
          }
        },
        "required": ["id", "category", "label", "description", "effects"],
        "additionalProperties": false
      }
    },
    "metadata": {
      "type": "object",
      "properties": {
        "sourceReview": {
          "type": "string",
          "pattern": "\\S"
        },
        "requirementRefs": {
          "type": "array",
          "items": {
            "type": "string",
            "pattern": "\\S"
          }
        },
        "sourceRegisterRefs": {
          "type": "array",
          "items": {
            "type": "string",
            "pattern": "\\S"
          }
        }
      },
      "additionalProperties": false
    }
  },
  "required": [
    "schemaVersion",
    "id",
    "system",
    "template",
    "displayName",
    "values",
    "createdAt",
    "modifiedAt",
    "entityType",
    "role",
    "entries"
  ],
  "additionalProperties": false
}
